{
  "schemaVersion": "locale-architecture-section-v1",
  "locale": "ko",
  "section": "아키텍처",
  "navLabel": "아키텍처",
  "contents": "아키텍처 목차",
  "groups": {
    "section": "섹션",
    "engine": "엔진",
    "evidence": "근거",
    "boundaries": "경계"
  },
  "pages": {
    "overview": {
      "nav": "개요",
      "title": "아키텍처 개요",
      "description": "Redact Secret의 구성을 설명합니다. 모든 언어가 호출하는 Rust 코어 하나, 그 코어의 판단을 측정하는 방법, 코어 밖에 있는 어댑터·볼트 저장소를 다룹니다."
    },
    "how-it-works": {
      "nav": "작동 방식",
      "title": "작동 방식",
      "description": "코어 하나 위의 네 가지 사용 방식, 파이프라인 네 단계, 그리고 이 도구가 하지 않는 일."
    },
    "detection": {
      "nav": "탐지 방식",
      "title": "탐지 방식",
      "description": "다섯 단계의 근거 등급, 고정된 우선순위 규칙, 정규식 엔진을 쓰지 않는 이유, 직접 만드는 룰셋."
    },
    "support-claims": {
      "nav": "지원 표기",
      "title": "지원 표기는 어떻게 만들어지나",
      "description": "세 파일이 세 가지 질문에 답하며, 셋을 합쳐야만 지원 표기가 만들어집니다."
    },
    "evaluation-methods": {
      "nav": "평가 방법",
      "title": "평가 방법",
      "description": "탐지기가 틀리는 열 가지 경우와, 바이트 범위를 기준으로 한 다섯 가지 판정."
    },
    "adapters": {
      "nav": "어댑터",
      "title": "어댑터",
      "description": "호스트와 엔진 사이에서 텍스트를 나르는 패키지입니다. 판단은 하지 않습니다."
    },
    "vault": {
      "nav": "볼트",
      "title": "볼트",
      "description": "원본을 보관할 수 있는 유일한 곳이며, 쉽게 보관하지 못하도록 설계했습니다."
    }
  },
  "pager": {
    "label": "아키텍처 페이지",
    "prev": "← 이전",
    "next": "다음 →",
    "back": "돌아가기 →"
  }
}
